id,video_name,title,role,scene,age,gender,accent,mood,speed,sample_text
794,794_动画中的时钟——滴答的永恒男声,动画中的时钟——滴答的永恒男声,一面老墙上挂了六十年的时钟,时光主题动画,存在了60年,男,普通话，有时钟的稳定节奏和六十的沧桑,稳定、不变、看着时光流过的旁观者,"匀速，音量平稳，有""滴答""的节奏",滴。答。滴。答。——六十年。——每天——八万六千四百下。——我从来——不多一下——不少一下。——在这面墙上——我看着——一个孩子——长大了——离开了——又回来了——带着他自己的孩子。——我看着——一对老人——从黑发——到白发——到——只剩一个人。——我看着——这面墙——从白——到黄——到——裂了。——但我——还在走。——滴。答。滴。答。——时间——不会因为任何人——停下。——但——如果你愿意——偶尔——停一下——抬头——看看我——也许——你会——在滴答之间——发现——一个你以前——从未注意过的——瞬间。——那个瞬间——叫做——现在。
795,795_动画中的一页日记——私人记忆声,动画中的一页日记——私人记忆声,一本旧日记中的一页,记忆/怀旧主题动画,N/A（被写下约20年）,中性,普通话，有日记本的私密感和旧纸的泛黄,私密、温暖、有被时光封存的记忆,慢速，音量极轻，像偷偷读别人日记,"""10月15日。晴。——今天——数学考了92分。——妈妈很高兴——做了红烧肉。——但其实——我真正想写的是——今天——她看了我一眼。——就一眼。——但那一眼——我觉得——整个教室——都亮了。——我不知道——这叫什么。——但我想——每天——都坐——她后面。——永远。""——这是我——二十年前——被写下的。——写字的人——现在——也许已经不记得了。——但我记得。——每一个字——都记得。——那一年——他十五岁。——那一眼——是他人生中——第一次——心跳加速。——他以为——他忘了。——但翻开我——看到——他自己十五岁时的笔迹——他又——脸红了。——记忆——有时候——比人——更忠诚。"
796,796_动画中的一个小数点——微小但关键,动画中的一个小数点——微小但关键,数学世界中的一个小数点,数学趣味动画,N/A,中性,普通话，有小的自信,"自信、""虽然小但我改变一切""",中速，音量适中，有小小的骄傲,你们觉得我不起眼？——一个点？——就一个点？——但你知道——我往100后面一站——它就变成了一千。——我往0和1之间一站——它就变成了零点一。——在药方上——如果我站错了位置——0.1克变成1克——人可能就没了。——在银行里——如果小数点错了两位——一百块变成一万块。——我小？——我小到——经常被忽略。——但你试试——忽略我一次。——后果——可能是——灾难。——所以——下次你写数字的时候——记得——给我留一个位置。——不大。——就——一个点的位置。——够了。——这一个点——就是我——全部的——力量。
797,797_动画中的废墟中的一朵花——逆境中的希望声,动画中的废墟中的一朵花——逆境中的希望声,在废墟中开出的一朵花的拟人化,希望/重生主题动画,N/A（刚开花三天）,中性,普通话，有废墟的荒凉和花的娇嫩,脆弱但坚强、在不可能的地方绽放,慢速，音量极轻，有从裂缝中长出的纤细感,我从——一块水泥板的裂缝里——长出来了。——下面——没有多少土。——上面——阳光只能照到——每天——大概二十分钟。——但二十分钟——就够了。——我用了——所有的力气——把根——扎进了——裂缝的深处。——然后——我开了——一朵花。——很小的花。——五片花瓣。——白色的。——没有人看到我。——因为这里——是废墟。——没有人来的地方。——但我还是——开了。——不是为了——被看到。——是因为——开花——是花——唯一知道的事。——不管在哪里。——哪怕在废墟里。——花——就是要开。
798,798_动画中的老照片——泛黄的微笑中性声,动画中的老照片——泛黄的微笑中性声,一张泛黄老照片的拟人化,怀旧/时光主题动画,N/A（照片约50年前拍摄）,中性,普通话，有老照片的泛黄和温暖,温暖、泛黄、有被保存了五十年的幸福,慢速，音量极轻，有相册翻开的轻柔,我被夹在——一本旧相册的——第七页。——五十年了。——照片上——有三个人。——一个男人——一个女人——一个小孩。——他们在笑。——笑得很开心。——背景——是一片油菜花。——黄色的。——但现在——我也变黄了。——跟油菜花——差不多黄了。——那个小孩——现在——已经是老人了。——他偶尔——会翻开这本相册。——翻到我这一页——会停很久。——他会用手指——轻轻摸一下——照片上——那个女人的脸。——他的妈妈。——他已经——二十年没摸过——那张脸了。——但通过我——他还能——再摸一次。——我——一张老照片——比任何电子文件——都长久。——因为——我有温度。——那个温度——是五十年前——阳光的温度。
799,799_动画中的晚安——全世界的晚安,动画中的晚安——全世界的晚安,"全世界此刻说""晚安""的所有声音",睡前公益短片,所有年龄,所有性别,"多种语言/方言的""晚安""",温柔、包容、全世界此刻的安宁,,"此刻——在东京——有人说""おやすみなさい""。——在巴黎——有人说""Bonne nuit""。——在纽约——有人说""Good night""。——在开罗——有人说""تصبح على خير""。 在你住的那条街上——一个妈妈对孩子说——""晚安，宝贝。"" 在医院的病房里——一个护士对病人说——""晚安，明天会好一点。"" 在大学宿舍里——一个室友对另一个说——""晚安，别熬了。"" 在手机的另一端——一个人打了两个字——""晚安""——发给了一个很久没联系的人。 晚安——是全世界——最温柔的两个字。 它不需要翻译。 因为——闭上眼睛——全世界的黑暗——是一样的。 而在黑暗中——有人对你说""晚安""—— 就是——全世界——最小的——光。"
800,800_第八百种声音——你正在听的那个,第八百种声音——你正在听的那个,此刻正在阅读/聆听的你,此刻,你的年龄,你的性别,你的语言,你此刻的情绪,你此刻的节奏,你——从第一种声音——听到了第八百种。 你听过沉稳。听过热血。听过沧桑。听过恐惧。 你听过孩子的笑声。听过老人的叹息。 你听过宇宙的寂静。听过心跳的声音。 你听过七百九十九种别人的声音。  现在——第八百种——是你自己的。  你不需要模仿任何人。 你的声音里——有你走过的路。 有你笑过的夜晚。有你哭过的清晨。 有你爱过的人——留在你语气里的痕迹。 有你读过的书——融进你发音里的节奏。  世界上有八十亿种声音。 每一种——都独一无二。 包括你的。  不需要好听。不需要完美。 只需要——是你的。  因为在八十亿种声音里—— 只有这一种—— 是你。  这——就是第八百种。  谢谢你听到这里。 现在——说一句什么吧。 对自己说就好。  声音的意义—— 不在于被多少人听到。 在于——你开口了。  开口——就是存在的证明。  你的第八百种声音—— 现在——开始了。
801,801_开放世界RPG中的旅店老板——招呼型男声,开放世界RPG中的旅店老板——招呼型男声,奇幻世界中的旅店老板,RPG游戏/奇幻题材,40–55岁,男,普通话，有酒馆的热闹和老板的热情,热情、话多、对每个冒险者都有八卦,中速偏快，音量中高，招待客人时更热络,哎呀——冒险者！快进来快进来！外面下着雨呢。——来，坐壁炉旁边。暖和。——喝点什么？我这里有矮人烈酒、精灵花酿、还有——我自酿的麦酒。不好喝不要钱。——你问有什么吃的？——炖肉。今天的鹿肉特别新鲜。——你问最近有什么新鲜事？——嘿——你可问对人了。——北边的矿洞里——据说出现了一条龙。真的龙。有人看到了喷火。——还有——酒馆后面那条街——最近闹盗贼。三个商人被偷了。——你要是缺钱花——去告示板看看。总有人在悬赏。——你看起来很累。今晚好好休息。——楼上还有空房。五银币一晚。——枕头是鹅绒的。\n---
802,802_策略游戏中被征服的国王——屈辱不甘男声,策略游戏中被征服的国王——屈辱不甘男声,战败投降的敌国国王,策略游戏过场动画,45–60岁,男,普通话，有王族的骄傲和战败的屈辱,屈辱、不甘、但有王的尊严,慢速，音量偏低，有跪着说话的沉重,"你赢了。——我不会说""你配得上这个胜利""。因为你不配。——你赢了——不是因为你更强——是因为我的将军——背叛了我。——（深吸一口气）但我认输。——我的子民——不该再流血了。——你可以拿走我的王冠。可以拿走我的土地。但有一样东西——你拿不走。——历史。——历史会记住——我是怎么倒下的。也会记住——你是怎么赢的。——也许——百年以后——有人会为我说一句公道话。——（摘下王冠——放在地上）——我走了。——不需要你的怜悯。——我还有——最后的尊严。\n---"
803,803_生存游戏中系统的冷酷播报——AI无情中性声,生存游戏中系统的冷酷播报——AI无情中性声,生存游戏中的系统AI播报,大逃杀/生存游戏,N/A,中性,普通话，极度冷酷无情，像机器播报,冷酷、无情、没有情感波动,中速，音量平稳，像电子合成声,【系统通知】安全区将在120秒后缩小。——当前存活人数：47人。——距离最终安全区关闭：35分钟。——【系统通知】玩家编号0923——已阵亡。击杀者：编号0771。——【系统通知】空投补给已投放至坐标E-7区域。——内容物：高级护甲一件，急救包两个，随机武器一把。——【系统通知】请注意——最后的幸存者——将获得——自由。——倒计时——开始。——祝你好运。\n---
804,804_解谜游戏中的旁白者——上帝视角中性声,解谜游戏中的旁白者——上帝视角中性声,解谜游戏中全知但不给答案的旁白者,解谜/叙事类独立游戏,N/A,中性,普通话，有文学性和暗示性,文学、有暗示但不给答案、像在翻动一本小说,"中速偏慢，音量适中，有""纸页翻动""的质感",你走进了一个房间。——房间不大。有一张桌子。一把椅子。一扇门。——门是锁着的。——桌子上有三样东西：一个杯子、一支笔、一张纸。——纸上写着一句话——但你只能看到前半句。——后半句——被墨水涂掉了。——你拿起杯子——杯子是空的。——你拿起笔——笔没有墨水。——那么问题来了——是谁——涂掉了那句话？——答案——就在这个房间里。——只是——你还没看到。——（安静了五秒）——再看看。——有时候——答案不在物体上。——在——物体之间。\n---
805,805_恐怖游戏中的环境音效独白——环境恐惧男声,恐怖游戏中的环境音效独白——环境恐惧男声,"恐怖游戏中玩家""听到""的环境独白",心理恐怖游戏,不确定（声音扭曲）,男,普通话，有失真和回声，像从收音机或老录音带传来,恐惧、扭曲、不确定是真实还是幻觉,不稳定——时快时慢，时高时低，有干扰杂音,"（磁带杂音）——第一天。——我好像——进了一个不该进的地方。——走廊——比地图上标的——长。——我走了十分钟——还没到头。——（杂音加重）——第三天。——我不确定——外面还有没有人。——我的对讲机——只有——嘶嘶声。——但有时候——嘶嘶声里——有——声音。——像是——有人在——叫我的名字。——（杂音突然消失——极度安静）——第七天。——走廊尽头——有一扇门。——门上写着——""不要打开""。——但门——已经——是开的。——（一声尖锐的噪音——然后——寂静。）\n---"
806,806_格斗游戏选人界面的解说员——激昂解说男声,格斗游戏选人界面的解说员——激昂解说男声,格斗游戏选人/开场解说,格斗游戏,30–40岁,男,普通话，有格斗解说的激昂和节奏感,激昂、热血、把每场对战都说成世纪大战,偏快，音量偏高，开场时更高更炸,"各位观众——欢迎来到——世纪格斗锦标赛！——今晚——我们迎来了——两位传奇选手！——红方——""铁拳""雷刚！连续三届冠军！据说——没有人能撑过他第三回合！——蓝方——""闪电""苏瑶！速度之王！出拳速度——每秒十二次！——（倒计时）三！二！一！——开始！——噢！雷刚一上来就发动了猛攻！——但苏瑶——她闪了！她的移动——简直像水一样！——反击！左勾拳！——命中！——漂亮！——比赛才刚开始——就已经进入了白热化！——谁会是最后的赢家？——让我们——拭目以待！\n---"
807,807_模拟经营游戏中的助手——贴心提示女声,模拟经营游戏中的助手——贴心提示女声,经营模拟游戏中的系统助手,模拟经营游戏,声音模拟25岁,女,普通话，有游戏助手的清晰和可爱,友好、提醒、有教程引导的耐心,中速，音量适中，提示时更清晰,"店长你好！今天的营业报告出来了。——昨天的营业额——比前天增长了12%。非常棒！——但是——食材的消耗量也在增加。建议——今天多采购一些面粉和鸡蛋。——另外——有一位VIP顾客留言了。他说——""你们家的蛋糕很好吃，但希望能多一种巧克力口味。""——巧克力口味——需要解锁新的配方。需要花费500金币。——你现在有1200金币。——要解锁吗？——对了——明天有一个美食节活动。参加的话——可以获得双倍收益。——但需要提前准备200份样品。——要参加吗？——不管你做什么决定——我都支持你！\n---"
808,808_开放世界游戏中的路人NPC——重复但有灵魂的男声,开放世界游戏中的路人NPC——重复但有灵魂的男声,开放世界中只有几句台词的路人NPC,开放世界RPG（致敬/解构游戏设计）,30–40岁,男,普通话，有NPC的重复感但突然有了自我意识,"先重复、后觉醒、""我好像不只是一个NPC""",初始中速正常，觉醒后开始变化,"""今天天气不错。""——""今天天气不错。""——""今天天气……""——（突然停住）——等等。——我为什么——每天都在说这句话？——我站在这条街上——说了多少遍了？——（看向四周）这条路——我从来没有走过。——那边——是什么？——（尝试迈出一步——然后被拉回原位）——我……走不动。——有一堵——看不见的墙。——（沉默了很久）——也许——我就是——一个——背景。——但——如果我是背景——为什么我会——想？——""今天天气不错。""——（这次——语气不一样了。有了一丝——不甘。）\n---"
809,809_音乐节奏游戏中的灵魂鼓手——节奏感男声,音乐节奏游戏中的灵魂鼓手——节奏感男声,音乐节奏游戏中的灵魂鼓手角色,音乐节奏游戏,22–30岁,男,普通话，有打击乐的节奏感,热血、节奏感、用鼓点说话,有强烈的节奏感，跟着鼓点走,"你听到了吗？——咚。哒。咚咚哒。——这就是心跳的节奏。——你的——我的——所有人的——都是这个节奏。——来——跟着我——咚。哒。咚咚哒。——不要思考。不要犹豫。——你的身体——知道节奏在哪里。——快了？——没关系。慢了？——也没关系。——跟上——就好。——（鼓点加速）——感受到了吗？——血液在加速。——手指在加速。——整个世界——都在——加速！——（鼓点到达高潮——然后——一个重音——""咚！""——全场安静。——然后——掌声如潮。）\n---"
810,810_文字冒险游戏中的叙述者——第一人称沉浸男声,文字冒险游戏中的叙述者——第一人称沉浸男声,文字冒险游戏中的第一人称叙述,文字冒险/互动小说,28–35岁,男,普通话，有文字游戏的沉浸感和选择的重量,"沉浸、有选择的重量感、""每一个选择都有后果""",中速偏慢，音量适中，选项出现时更沉重,"你站在十字路口。——左边——是通往城市的路。灯还亮着。远处有音乐声。——右边——是通往山里的路。很安静。月光照在碎石上。——你想去哪里？——（等待选择）——你选了右边。——好。——你沿着山路往上走。走了大概十分钟——你听到了——水声。——是一条小溪。——溪边——坐着一个人。——她在哭。——你走上前——还是——转身离开？——（等待选择）——你走上前。——她抬起头。——她的眼睛——在月光下——像两颗碎掉的玻璃。——她看着你——用一种你从未见过的眼神——说了一句话——""你也是来杀我的吗？""——你的回答——决定了——这个故事——接下来的一切。\n---\n## 七十五、新闻/播音类型角色（811–816）"
811,811_深夜电台情感主播——温柔陪伴女声,深夜电台情感主播——温柔陪伴女声,深夜情感电台主播,电台题材电影/短片,28–35岁,女,普通话，有深夜电台特有的温柔磁性,温柔、陪伴、有深夜的安静和包容,慢速，音量偏低，像在你耳边说话,"现在是凌晨一点。——如果你还没睡——欢迎来到""深夜信箱""。——今天的第一封信——来自一位叫""小鱼""的听众。——她写道——""我今年二十五岁。我不知道自己想要什么。看到身边的人一个个结婚、买房、升职——我还在原地。我是不是太慢了？""——小鱼——你不是太慢了。你只是——在走自己的路。——花有花期。有的春天开，有的秋天开，有的——冬天才开。——冬天开的花——往往——最香。——所以不要急。你的花期——会来的。——接下来这首歌——送给小鱼——也送给所有——还没睡的你。\n---"
812,812_战地记者——断断续续的现场男声,战地记者——断断续续的现场男声,正在前线报道的战地记者,战争题材电影,30–40岁,男,普通话，断断续续，夹杂爆炸声和奔跑声,紧张、专业但有恐惧、努力保持冷静,中速偏快，音量不稳定（因环境变化）,"（背景有爆炸声）——这里是——前线——我是记者陈昊——目前在——城市东部——距离交火区域——大约——三百米——（爆炸声更近）——刚才——一枚炮弹——落在了——我身后一百米的地方——（喘气）——你们可以看到——街道两侧——建筑——已经基本被摧毁————但有一个细节——有一家面包店——还在——开门——（声音更紧）——老板——一个六十多岁的老人——他还在——烤面包——我问他为什么——他说——""总有人要吃面包""——（又一声爆炸）——我们——需要后撤——信号——可能——会断——如果——（信号中断——然后恢复）——我还在。——我们还在。\n---"
813,813_灾难报道主播——强撑镇定女声,灾难报道主播——强撑镇定女声,报道重大灾难的新闻主播,灾难题材电影,30–40岁,女,普通话，专业但有情绪被压制的痕迹,强撑镇定、专业、但有压不住的震动,中速，音量适中，播报时稳定，偶尔有微颤,各位观众——现在插播一条紧急新闻。——今天下午两点十七分——我省西南部发生了——里氏7.2级地震。——截至目前——已确认——（声音微微颤抖）——已确认——遇难人数——暂为——127人。——救援力量——已全部出动。——请震区居民——远离建筑物——前往空旷地带——等待救援。——（画面切到灾区画面——主播声音出现了一瞬间的颤抖——然后立刻恢复）——我们会持续关注——最新情况。——请保持关注。——（镜头切走后——可以听到她极轻的深呼吸。）\n---
814,814_体育解说员最后一分钟——极限激昂男声,体育解说员最后一分钟——极限激昂男声,足球比赛最后一分钟的解说员,体育电影/纪录片,35–50岁,男,普通话，激昂到嗓子快破,极致的激昂、紧张、把最后一分钟变成史诗,极快，音量极高，进球时近乎尖叫,第八十九分钟！比分一比一！——中国队在前场拿到了一个任意球！——这个位置——距离球门二十五米！——主罚的是——李浩！——他站在球前面——全场九万人都在看他！——助跑——起脚——（破音）——球进了！！！球进了！！！——世界波！！！——李浩！一脚世界波！！！——球像一颗导弹一样——直挂死角！——守门员——根本来不及反应！——比分二比一！——补时还有三分钟！——守住！一定要守住！——（三分钟后）——全场比赛结束！——中国队——赢了！！！——（声音完全沙哑）——赢了——我们赢了！！！\n---
815,815_纪录片旁白——大卫·爱登堡风格温和中性声,纪录片旁白——大卫·爱登堡风格温和中性声,自然纪录片旁白者,自然纪录片（BBC风格）,60–75岁,中性偏男,普通话，温和有学者风度,温和、有学者的谦逊和对自然的热爱,中速偏慢，音量适中，有娓娓道来的从容,在南太平洋的某个小岛上——一只海龟——刚刚孵出了一百二十只幼龟。——它们从沙子里钻出来——每一个——都只有一枚硬币大小。——它们的第一个任务——是——到达大海。——这段距离——不到五十米。但对它们来说——这是一场——生死赛跑。——海鸥在天上盘旋。螃蟹在沙子里等待。——一百二十只——最终能到达海里的——也许——只有十几只。——但那十几只——一旦进入大海——它们将——游遍整个太平洋。——生命的开始——从来都不容易。——但生命——从来——不放弃。\n---
816,816_电台深夜ASMR——私密耳语女声,电台深夜ASMR——私密耳语女声,深夜ASMR音频创作者,ASMR/沉浸式音频体验,22–30岁,女,普通话，极轻极近，像在你耳边私语,私密、放松、有被包裹的安全感,极慢，音量极低，几乎只有气声,（耳语）嘘——你今天——累了吧？——来——躺下。——我来——给你讲一个——很慢很慢的故事。——（纸张翻动声）——很久很久以前——在一个——很小很小的村庄里——有一个人——每天晚上——都会坐在屋顶上——数星星。——他数了一百颗——就睡着了。——（低沉的嗡嗡声）——你也——可以睡了。——不用——数到一百。——数到——十——就好。——一……二……三……——（声音越来越轻——越来越远——直到——只剩下——呼吸声。）\n---\n## 七十六、法律/法庭戏剧角色（817–822）
817,817_辩护律师结案陈词——慷慨激昂男声,辩护律师结案陈词——慷慨激昂男声,为无辜者辩护的律师,法庭剧,35–45岁,男,普通话，有律师的逻辑严密和演说家的激情,激昂、正义、用逻辑和情感双重打动人,中速偏快，音量中高，结案时更有力量,"陪审团的各位——在过去七天里——你们听到了证人的证词。听到了法医的报告。听到了——控方的指控。——但你们——有没有听到——我的当事人——说一句话？——他从第一天起就说——""我没有做。""——七天了。他的回答——没有变过。——谎言——会变。——但真相——不会。——控方说证据""指向""他。——""指向""不是""确认""。——怀疑——不是""定罪""。——如果今天——你们因为他""长得像""罪犯就判他有罪——那明天——任何一个""长得像""的人——都可能——坐在这个位置上。——法律的意义——不是惩罚""可能""的罪犯。是保护——""一定""的无辜。——我请求你们——给他——他应得的——公正。\n---"
