id,video_name,title,role,scene,age,gender,accent,mood,speed,sample_text
566,566_喜剧动画中的倒霉侦探——笨拙推理男声,喜剧动画中的倒霉侦探——笨拙推理男声,总是推理错误但运气好破案的侦探,喜剧侦探动画,30–40岁,男,普通话，推理时一本正经，结论总是错的,自信满满的错误推理、事后自圆其说,中速，音量中等，推理时很有仪式感,好了，各位。真相只有一个！凶手就是——你！（指向一个人）——什么？你有不在场证明？——（指向另一个人）那就是你！——什么？你当时在国外？——（只剩一个人了）那就是——等等，你又是谁？——你是来送外卖的？——好吧。（尴尬）那个……其实我从一开始就知道凶手是谁了。我刚才只是……在排除法。对，排除法。真正的凶手——（翻笔记本）——就是他！——什么？他已经认罪了？在五分钟前？——我就知道！一切都和我推理的一模一样！（对助手小声说）——快帮我把笔记本翻到对的那一页。
567,567_历史片中的旁白——史官般中正男声,历史片中的旁白——史官般中正男声,历史正剧旁白（史官视角）,历史正剧开场/转场,40–55岁,男,普通话，中正平和，有史官的客观,中正、客观、有历史的厚重感,中速偏慢，音量适中，有跨越时间的从容,公元626年，七月二日。长安城。玄武门外。两个时辰之内，大唐帝国的命运被彻底改写。秦王李世民在这座城门之下，射杀了太子李建成和齐王李元吉。三日后，高祖李渊退位。李世民登基。是为唐太宗。史书上只有寥寥数笔。但那天的玄武门——有血，有泪，有一个年轻人在权力和亲情之间做出的最残酷的选择。后世称他为千古明君。但他永远忘不了那一天——哥哥倒下时，看向他的那个眼神。
568,568_纪录片中的儿童——天真无畏童声,纪录片中的儿童——天真无畏童声,在恶劣环境中长大的孩子,儿童题材纪录片,7–10岁,男,略带方言的普通话，稚嫩但有超乎年龄的坚强,天真、坚强、有孩子特有的乐观,中速，音量适中，提到困难时轻描淡写,"我每天早上五点起来走路上学。走一个半小时。——不远嘛。就是有一段路没有灯，有点黑。黑的时候我就唱歌。唱着唱着就不怕了。——你问我长大想做什么？我想当飞行员。因为我从来没坐过飞机。我想知道——从天上看下来，我们村是什么样子的。——我现在攒了三十七块钱了。飞机票要多少钱？——好几千？（愣了一下）那我再攒攒。总有一天能攒够的。我妈妈说""有志者事竟成""。我不太懂什么意思。但我猜——大概就是""别放弃""的意思吧。"
569,569_动画中的老钟楼守护者——有节奏的苍老男声,动画中的老钟楼守护者——有节奏的苍老男声,守护城市钟楼的老人,童话风格动画电影,70–85岁（声音年龄）,男,普通话，有钟摆般的节奏感,安详、有仪式感、与钟声融为一体,慢速，音量偏低，有钟楼般的回响感,叮——咚——。又一个小时过去了。——我守着这座钟楼守了五十年。每天上发条、擦齿轮、校准时间。五十年——我看着城里的孩子长大、看着他们离开、看着他们的孩子又长大。钟楼不知道这些。它只知道——准时。每一声钟响——不多一秒，不少一秒。——人要是也能这样就好了。该来的时候来，该走的时候走。不早，不晚。——但人不是钟。人会迟到，会错过，会忘记。所以才需要我——在最高的地方，替所有人记住时间。
570,570_穿越片中回到过去的现代人——文化冲击男声,穿越片中回到过去的现代人——文化冲击男声,意外穿越到古代的现代人,穿越题材电影,25–30岁,男,普通话，对古代一切感到震惊,震惊、困惑、试图融入但不断破功,中速偏快，音量中等，遇到不解时更高,"等等等等——你们不用手机？那你们怎么叫外卖？——没有外卖？那你们怎么活？——你们自己做饭？用那个——火？真正的火？——（看到毛笔）这是什么？笔？这个怎么写字？我在手机上打字一分钟能打一百个——你们用这个写一封得写到什么时候？——什么？你们这里没有Wi-Fi？——Wi-Fi就是……算了说了你也不懂。——（看到马车）这就是你们的""出租车""？速度也太——等等——（被颠了一下）这也太颠了！能不能开稳一点！——（车夫说""马不听我的""）你连导航都没有就敢出来拉客？！"
571,571_动画中的季节精灵——四季轮转女声,动画中的季节精灵——四季轮转女声,掌管四季轮转的精灵,奇幻童话动画,声音无年龄感（永恒存在）,女,普通话，声音随季节变化——春嫩、夏烈、秋柔、冬寒,四季各有气质——春的生机、夏的热情、秋的感伤、冬的宁静,春中速偏快，夏快速高昂，秋中速偏慢，冬极慢极轻,"【春】我来了——冰雪化了，种子醒了。你闻到了吗？泥土翻开的味道——那是大地在呼吸。 【夏】我来了——阳光倾泻，蝉声如潮。一切都在疯长——花在开，果在熟，生命在狂欢。 【秋】我来了——叶子红了，该落了。不是悲伤——是圆满。每一片落叶都是大树说的""谢谢""。 【冬】我来了——安静了。世界裹上了白。万物都在休息。包括你——你也该歇歇了。明年见。"
572,572_科幻片中的量子物理学家——着迷女声,科幻片中的量子物理学家——着迷女声,量子物理学家,硬科幻电影,30–40岁,女,普通话，有科学家的着迷和认真,着迷、兴奋、对未知的渴望,中速偏快（兴奋时更快），音量适中,"你们看到了吗？这个粒子——它同时存在于两个位置。不是在两个位置之间移动——是同时在两个位置。这违反了你学过的所有物理常识。但量子世界就是这样的——在你观察它之前，它什么都是。在你观察它的那一刻——它才""选择""成为一个确定的状态。——这意味着什么？意味着——现实可能不是固定的。你的每一次观察，都在参与现实的""创造""。你不是旁观者——你是参与者。——我知道这听起来像科幻。但这就是科学。真相永远比虚构更离奇。"
573,573_灾后重建者——不屈女声,灾后重建者——不屈女声,地震后重建家园的普通女性,灾后重建纪录片/电影,35–45岁,女,略带方言的普通话，有不屈的力量,"不屈、有韧劲、""日子还要过""的朴素信念",中速，音量适中，有女性特有的韧劲,"房子倒了。我从废墟里扒出来两床被子和一口锅。就这些。——（看着废墟）哭？当然哭过。但哭完了呢？日子还是要过。——第二个月，我们在空地上搭了帐篷。第三个月，政府的重建房开始动工了。我每天去工地帮忙搬砖。有人说""你一个女人搬什么砖""。我说""这砖搬一块少一块，房子盖一层高一层""。——（新房盖好那天）我站在门口看了好久。比原来的房子小。但是——是新的。从零开始也好。说明一切都有可能。"
574,574_动画中的黑夜守卫者——英勇女声,动画中的黑夜守卫者——英勇女声,"保护孩子不做噩梦的""黑夜守卫者""",儿童奇幻动画,25–30岁（声音年龄）,女,普通话，有盔甲般的坚定和月光般的温柔,英勇、温柔、给孩子安全感,中速，音量适中，安慰孩子时更轻柔,别怕。我是黑夜守卫者。我的工作就是在你睡觉的时候，把噩梦赶走。——你看，这把剑是用月光做的。噩梦最怕月光了。——你刚才梦到了什么？一个很大的怪物？——别担心。我已经把它赶走了。它跑到云后面去了。明天它就会变成一朵棉花糖。——（蹲下来）你要知道——黑暗里没有怪物。黑暗里只有——我。我会一直在这里。直到太阳出来。——闭上眼睛吧。梦里会有彩虹和小兔子。我保证。晚安。
575,575_残障题材影片中的轮椅少年——倔强男声,残障题材影片中的轮椅少年——倔强男声,坐轮椅但不认输的少年,残障题材励志电影,14–18岁,男,普通话，有少年的倔强和不屈,倔强、不屈、偶尔流露脆弱,中速偏快，音量中等，被同情时语气变硬,你别用那种眼神看我。我不需要同情。——是的，我坐轮椅。那又怎样？我的腿不能动，但我的脑子能动。我的手能动。我的眼睛能看到你们看不到的东西。——你知道吗？我每天比你们早起一个小时——因为我需要更多的时间做你们一秒钟就能做的事情。穿衣服、洗漱、上厕所。一个小时。——但我从来没有迟到过。——你问我恨不恨？恨什么？恨命运？命运又听不到。我只想证明——轮椅不是终点。它只是另一种出发的方式。
576,576_动画中的雨滴旅行者——轻快灵动声,动画中的雨滴旅行者——轻快灵动声,从云到海的一滴雨的拟人化,自然教育动画,声音无明确年龄（拟人化小水滴）,中性,普通话，轻快灵动，有水的流动性,好奇、欢快、对旅程的热爱,中速偏快，音量中等，跳跃感,嗨！我是一滴雨！刚才我还是一朵云——风一吹，我就变成雨掉下来了！我落在了一片叶子上——哇，叶子好绿好滑！然后我顺着叶子滑下去——滑到了一条小溪里。好多小伙伴在这里！我们手拉手一起跑——跑过了石头、跑过了桥洞、跑进了一条大河。大河好宽啊！我从没见过这么多水在一起。听说我们要去的地方叫——大海。大海是什么？是所有水滴的家。我好期待啊！——对了，到了大海以后，我又会变成云——然后再变成雨——然后再落下来。这叫——水循环。是不是很酷？
577,577_纪录片中的记忆退化老兵——碎片化回忆男声,纪录片中的记忆退化老兵——碎片化回忆男声,记忆逐渐退化的老兵,老兵口述历史纪录片,85–95岁,男,普通话，记忆碎片化，时断时续,努力回忆、时而清晰时而模糊、偶尔闪回,极慢，音量偏低，清晰记忆处突然有力,"我……打过仗。哪一年？……让我想想。19……50？还是51？……我记不太清了。但是有一件事我记得——我们连……有个小战士，姓……姓什么来着？……个子很小……还没枪高。有一次……他……他给我一个馒头。他说""排长你吃，我不饿""。但我看到他的手……在发抖。后来……（突然清醒）他叫小刘！刘建民！他牺牲了。我记了一辈子的名字。有些人——你可以忘掉很多事情——但有些名字——你一辈子都忘不掉。（眼神又开始模糊）……他叫什么来着？……刘……建民。对。刘建民。"
578,578_纪录片中的城市清洁船船长——水面感男声,纪录片中的城市清洁船船长——水面感男声,河道清洁船船长,城市环保纪录片,40–55岁,男,略带方言的普通话，有水面工作者的踏实,踏实、默默无闻、对自己工作有自豪感,中速偏慢，音量中等，有水波般的节奏,我在这条河上开了十年清洁船。每天早上六点出船，把河面上的垃圾捞干净。最多的一天捞了三吨。三吨。你能想象吗？三吨垃圾漂在一条河上。——塑料袋、饮料瓶、旧衣服、有时候还有沙发。——有人觉得这活儿不体面。但你看看现在的河——比十年前清了不知道多少倍。以前河水是黑的，现在你能看到鱼了。上周还有人在这儿钓鱼。——我不会说什么大道理。我只知道——这条河干净了，这座城市就好看了一点。我做的事情虽小，但它每天都在起作用。
579,579_魔幻电影中的命运之书守护者——宿命感女声,魔幻电影中的命运之书守护者——宿命感女声,"守护""命运之书""的神秘女子",魔幻电影,外表30岁，实际存在了千年,女,普通话，有宿命感和超然,超然、宿命、看透一切但不说破,慢速，音量轻柔，有图书馆般的安静感,你来查阅命运之书？——每一个来这里的人都想知道自己的未来。但你知道吗——真正读过自己命运的人，没有一个不后悔的。——你还想看？——好。翻到第——（翻页声）——这一页。——你看到了什么？——（沉默）——我看到了你闭上了书。你后悔了。——我早就说过。命运这种东西——知道了不如不知道。因为知道以后——你做的每一个选择，都不是自由意志了。它是——宿命。——你走吧。把看到的忘掉。如果你能做到的话。
580,580_电影中的旁白诗人——诗意男声,电影中的旁白诗人——诗意男声,文艺电影中的画外旁白,文艺/诗意风格电影,30–45岁,男,普通话，有诗人的敏感和文艺气质,诗意、敏感、有对日常的非凡观察,中速偏慢，音量适中，有散文诗的节奏,"那年夏天的雨来得很突然。我们在一家旧书店的屋檐下躲雨。你翻着一本发黄的诗集，我看着你翻书的手指。雨声很大，大到我们不得不凑近了说话。你说了一句什么——我没有听清。不是因为雨声太大——是因为你说话的时候，我只注意到了你嘴角那颗很小的痣。后来雨停了。你走了。我买下了那本诗集。扉页上有一行铅笔字——""献给在雨中等过我的人""。我不知道那是谁写的。但我愿意相信——那是你。"
581,581_喜剧电影中的史上最倒霉特工——自嘲男声,喜剧电影中的史上最倒霉特工——自嘲男声,总是搞砸任务但运气好的特工,特工喜剧电影,30–38岁,男,普通话，自嘲型幽默,自嘲、倒霉但总能化险为夷,中速，音量适中，搞砸事情时声音变虚,"我是特工00……算了不报编号了，上次报完编号被敌人笑了半天。这次的任务是——潜入敌方基地，窃取机密文件。听起来很酷对吧？——计划是这样的：从通风管道进去，黑掉监控，三分钟搞定。——（画面切换：他卡在了通风管道里）这不是我的错——管道太窄了。——（画面切换：误触了警报）这不是我的错——按钮太隐蔽了。——（画面切换：机密文件拿到了但跑错了方向跑到了敌方指挥官办公室）这——好吧这确实是我的错。——但你猜怎么着？指挥官不在。我在他桌上留了一张纸条：""谢谢，文件我拿走了。""——最后任务还是完成了。方式跟计划不太一样。但——结果是好的嘛。"
582,582_青春片中的暗恋旁白——心酸甜女声,青春片中的暗恋旁白——心酸甜女声,青春电影中暗恋者的第一人称旁白,青春暗恋题材电影,16–18岁,女,普通话，有少女的细腻和小心思,甜蜜又心酸、小心翼翼、不敢说出口,中速偏慢，音量轻柔，内心独白更小声,"他今天穿了一件白色的衬衫。第三颗扣子没有扣。我不知道为什么会注意到这种事。但我就是注意到了。——他跟别人说话的时候，我假装在看书。但我一页都没翻。——放学的时候他从我身边走过。他说了一句""明天见""。不是对我说的——是对所有人。但我固执地认为——他最后看了我一眼。也许没有。也许只是我的余光在自作多情。——我把今天他穿白衬衫的事写在了日记里。这本日记，已经写了一百二十三天了。每一页都是他。他不知道。永远都不会知道。"
583,583_动画中的种子旅行者——生命感中性声,动画中的种子旅行者——生命感中性声,随风旅行的蒲公英种子,自然教育/生命主题动画,声音无年龄感,中性,普通话，轻盈有生命感,好奇、无畏、对新生命的期待,中速，音量轻，有被风吹着的飘浮感,风来了——我离开了妈妈。别担心——妈妈说，每一个孩子都要离开的。因为只有离开，才能找到属于自己的土地。——现在我在天上飞。好高啊！我能看到山、看到河、看到一座座小房子。我不知道我会落在哪里。也许是肥沃的花园——那太好了。也许是石头缝里——那也没关系。只要有一点点土、一点点水、一点点阳光——我就能活。我就会发芽、长大、开花。然后——让风带走我的孩子。就像妈妈曾经让风带走我一样。这叫——生命。永不停止的生命。
584,"584_悬疑片中的""不可靠叙述者""——真假难辨男声","悬疑片中的""不可靠叙述者""——真假难辨男声",叙述者所说的一切可能是谎言,悬疑反转电影,30–40岁,男,普通话，真诚到让人无法怀疑（但可能是假的）,表面真诚、实际在操控观众认知,中速，音量适中，叙述时平稳可信,我没有杀她。你们要相信我。——那天晚上我在家看电视。一个人。没有证人——因为我习惯了一个人。——你们找到的那把刀？不是我的。上面有我的指纹？那是因为……我之前在厨房切过水果。——她脖子上的淤青？我不知道怎么来的。——你们为什么一直看着我？我没有在撒谎。——（反转：画面闪回，他确实在场）——好。我重新说。那天晚上——我确实去找她了。但我们只是聊了聊天。——（再次闪回：争吵声）——好吧，我们吵了一架。但——我没有碰她。——（第三次闪回：画面中他伸出了手）——（声音变低）……也许……碰了一下。
585,585_定格动画中的黏土角色——手工质感男声,定格动画中的黏土角色——手工质感男声,定格动画中的黏土小人,定格动画电影,声音无明确年龄（有手工感）,男,"普通话，声音有""手工制作""的质朴感",质朴、笨拙但可爱、有定格动画的节奏,"中速，音量适中，有""一帧一帧""的微卡顿感",我是一个黏土人。我的头是圆的——因为捏的时候手抖了一下。我的左手比右手大——也是因为手抖了。但我觉得这样挺好。——每天早上，有一双很大的手把我摆到一个新的位置。我不能动——但我能看。今天我被摆到了一棵纸做的树下面。树上有一只毛线做的鸟。——很好看。——晚上，那双手把我放回盒子里。盒子很黑。但我知道——明天醒来的时候，我又会看到一个新的世界。——这就是我的人生。一帧一帧的。慢慢的。但是——完整的。
586,586_音乐MV中的独白角色——歌曲之间的叙述女声,音乐MV中的独白角色——歌曲之间的叙述女声,音乐MV中歌曲之间穿插的独白角色,叙事型音乐MV,22–30岁,女,普通话，有MV的视觉感和情绪流,感性、有MV的流动感和碎片感,慢速，音量轻柔，有MV画面的配合感,（音乐渐弱，独白开始）我给你写了一封信。写了七天。第一天写了三页。第二天删到两页。第三天只剩一页。第四天改成了一句话。第五天——那句话也删了。第六天——我把信纸折成了一架纸飞机。第七天——我站在天台上，把它扔了出去。纸飞机飞得很远。比我以为的远。然后风停了。它落了。落在了一个我看不到的地方。（音乐渐起）——也许收信的人——本来就不需要读到那封信。他只需要知道——有人写过。
587,587_默片致敬短片中的字幕旁白——夸张时代感男声,默片致敬短片中的字幕旁白——夸张时代感男声,致敬默片时代的字幕旁白,默片致敬短片,30–45岁,男,民国国语风格，夸张戏剧化,戏剧化、夸张、致敬早期电影,变化极大，紧张时快且高，温情时慢且柔,"第一幕——爱情的邂逅。他走在街上。她也走在街上。他们的目光——相遇了！刹那间——时间停止了！天空变成了粉红色！鸟儿开始唱歌！——他的心跳加速！每分钟一百二十下！——他鼓起勇气走上前去——张开了嘴——说了一句——""你好""。——她回了一句——""你好""。——就这样。世界上最简单的两个字。但从此——一切都不同了。（音乐转为甜蜜的小提琴）"
588,588_互动电影中的旁白引导者——中性引导声,互动电影中的旁白引导者——中性引导声,互动电影中引导观众做选择的旁白,互动式电影/游戏化影视,N/A,中性,普通话，中性清晰，有引导感,中性、不带偏向、给观众空间,中速，音量适中，选择提示时更清晰,"他站在十字路口。左边通向旧的生活——安全的、熟悉的、没有惊喜的。右边通向未知——也许更好，也许更糟，没有人知道。——他必须做出选择。——现在，轮到你了。你替他选。向左——还是向右？——记住，每一个选择都会改变故事的走向。没有""正确""的答案。只有""你的""答案。——你选好了吗？——好。让我们看看——这个选择，会把他带向什么样的结局。"
589,589_儿童安全教育短片中的安全小卫士——活泼可爱声,儿童安全教育短片中的安全小卫士——活泼可爱声,儿童安全教育动画中的安全小卫士,儿童安全教育视频,6–8岁（声音年龄）,男,普通话，活泼可爱，适合小朋友,活泼、认真、像在跟小朋友做朋友,中速，音量适中，重要提醒时加重但不吓人,小朋友们好！我是安全小卫士安安！今天我们来学一个很重要的知识——过马路！你知道过马路要注意什么吗？第一——红灯停、绿灯行。这个你们都知道对不对？第二——走斑马线。不要跑，不要跳，一步一步走过去。第三——过马路的时候不要看手机，不要追球，不要弯腰捡东西。因为——汽车它不认识你。它不会因为你可爱就停下来。所以——你要自己保护自己。记住安安说的话了吗？记住了就拍拍手！啪啪啪！你们太棒了！
590,590_老电影修复纪录片中的修复师——细腻女声,老电影修复纪录片中的修复师——细腻女声,胶片电影修复师,电影修复纪录片,30–40岁,女,普通话，有胶片般的细腻感,细腻、对老电影的热爱、有修复者的耐心,中速偏慢，音量适中，描述修复过程时更细,"这部电影是1948年拍的。胶片已经严重老化——画面全是划痕、霉斑，颜色也偏了。修复一帧画面，有时候需要三到四个小时。一部九十分钟的电影，有将近十三万帧。——你问我烦不烦？不烦。因为每一帧背后都是一群人的心血。你看这个镜头——女主角回头的那一刻——七十七年前，有个灯光师在打光，有个摄影师在调焦，有个导演在喊""过了""。他们不会想到，七十七年后有个我，坐在电脑前一帧一帧地帮他们擦掉时间的灰尘。修复电影——不是技术活。是对时间的一次温柔的抵抗。"
591,591_黑白电影风格独白——经典好莱坞男声,黑白电影风格独白——经典好莱坞男声,经典黑白电影中的硬汉侦探,黑白电影风格致敬短片,35–45岁,男,普通话（模拟经典好莱坞风格），深沉有质感,冷硬、犬儒、有经典黑色电影的调调,慢速，音量偏低，独白像在烟雾中低语,"这座城市有两副面孔。白天属于那些穿西装打领带的人。夜晚——属于我们。我叫杰克·莫顿。私家侦探。我的办公室在四楼，窗户对着一面墙。完美的隐喻——我的人生也对着一面墙。那天晚上门开了。她走进来——黑裙子、红嘴唇、眼神里带着一种能点燃火柴的忧愁。她说""帮我找一个人""。我说""找人很贵""。她说""我付得起""。我知道这是一个麻烦。但麻烦——从来都是最漂亮的女人带来的。"
592,592_微距摄影纪录片中的微观旁白——细致入微男声,微距摄影纪录片中的微观旁白——细致入微男声,微距自然纪录片旁白,微距自然纪录片,30–40岁,男,普通话，极度细致入微,好奇、细致、对微观世界的惊叹,慢速，音量偏低，像在用放大镜说话,"你现在看到的——是一滴水。放大四百倍以后，它变成了一个宇宙。水滴的表面张力形成了一层透明的""皮肤""——像一颗液态的星球。里面有微生物在游动——那些小小的光点，每一个都是一个完整的生物体，有自己的一生。这个圆球形的小东西叫草履虫——它只有一个细胞。一个细胞就是一条命。它用纤毛游泳，用口沟进食，用伸缩泡排泄——所有生命活动都在一个肉眼看不见的小点里完成。当你下次洗手的时候，请记住——你冲走的不是""一滴水""。你冲走的——是一整个世界。"
